{"authors":[{"name":"localhost"}],"description":"Podujatia a správy","feed_url":"http://localhost:9090/x/views/city/feed/v1/vsetky/feed.json","items":[{"content_text":"Futbal","date_modified":"2026-10-03T10:00:00Z","date_published":"2026-10-22T09:15:08Z","id":"tag:localhost,2026:city/urn:ngsi-ld:Event:e2","tags":["šport"],"title":"Futbal"},{"content_text":"<script>alert(1)</script>","date_modified":"2026-10-02T10:00:00Z","date_published":"2026-10-22T09:15:08Z","id":"tag:localhost,2026:city/urn:ngsi-ld:Event:e1","summary":"<script>alert(1)</script>","tags":["kultúra"],"title":"Koncert & <b>]]> \"x\"","url":"https://bbsk.sk/koncert?a=1&b=2"},{"content_text":"Správa","date_modified":"2026-10-01T00:00:00Z","id":"tag:localhost,2026:city/urn:ngsi-ld:Article:a1","title":"Správa"}],"language":"sk","title":"Všetko","version":"https://jsonfeed.org/version/1.1"}